{
  "catalogVersion": "1.0.0-100000-test",
  "entries": [
    {
      "domain": "strategy",
      "evidenceId": "strategy-bytes-unavailable",
      "fieldPath": "raw.serialized",
      "reason": "Unity serialized bytes were unavailable from the captured object reader.",
      "severity": "warning",
      "status": "unresolved",
      "subjectId": "cfg-linked-evidence"
    }
  ],
  "generatedAt": "2026-07-16T00:00:00.000Z",
  "releaseId": "test-release",
  "schemaVersion": "1.0.0",
  "source": {
    "kind": "fixture"
  }
}
